{
  "$schema": "./artifact-v1.schema.json",
  "protocolVersion": "v1",
  "description": "Canonical, language-neutral conformance vectors for local (offline) QODIQA artifact and transparency-proof verification. Every signature, hash, and Merkle proof was generated by calling the production signing/hashing implementation directly — see \"generatedBy\" below and test-vectors/README-artifact.md for the full process and update procedure.",
  "generatedBy": {
    "generatorScript": "test-vectors/generate-artifact-vectors.js",
    "serverImplementation": [
      "src/validation/signArtifact.js",
      "src/utils/stableStringify.js",
      "src/infra/crypto/ed25519.js",
      "src/core/transparency/merkle.js",
      "src/core/transparency/log.js"
    ],
    "generatedAt": "2026-10-27T16:27:16.446Z"
  },
  "vectorCount": {
    "artifact": 9,
    "transparency": 11
  },
  "artifactVectors": [
    {
      "id": "valid-artifact",
      "description": "A genuine artifact signed by the production signer, verified with the correct trust bundle.",
      "tags": [
        "positive"
      ],
      "artifact": {
        "expiry": 1767229200000,
        "payload": {
          "requestId": "req-conformance-001",
          "requestHash": "aaaaaaaaaaaaaaaaaaaaaaaaaaaaaaaaaaaaaaaaaaaaaaaaaaaaaaaaaaaaaaaa",
          "policyHash": "bbbbbbbbbbbbbbbbbbbbbbbbbbbbbbbbbbbbbbbbbbbbbbbbbbbbbbbbbbbbbbbb",
          "tenantId": "test-vectors"
        },
        "publicKeyId": "test-vectors:key_v1",
        "signature": "cDfYrmT+C+DWcJJtDD+EZy1LyTwViUhGDUkRWcbFZSuV51B1NdcIa/ADeaWRcoicQXuLMFeWtRR03U93KQTNDQ==",
        "timestamp": 1767225600000
      },
      "keySet": [
        {
          "keyId": "test-vectors:key_v1",
          "algorithm": "ed25519",
          "publicKey": "MCowBQYDK2VwAyEArI9wKSGHg7Ig9ZtbOg+7d/QSddFvQ9xHSQxJ7ErydFs=",
          "status": "active"
        }
      ],
      "verifyAt": 1767225601000,
      "clockToleranceMs": 0,
      "transparencyProof": null,
      "expected": {
        "verificationStatus": "valid",
        "signatureValid": true,
        "payloadHashValid": true,
        "canonicalizationValid": true,
        "keyValid": true,
        "keyStatus": "active",
        "timestampValid": true,
        "expiryValid": true,
        "failedStage": null
      }
    },
    {
      "id": "tampered-payload-field",
      "description": "Genuine artifact with one payload field mutated after signing; signature is now over the wrong bytes.",
      "tags": [
        "negative",
        "tamper"
      ],
      "artifact": {
        "expiry": 1767229200000,
        "payload": {
          "requestId": "req-conformance-001",
          "requestHash": "aaaaaaaaaaaaaaaaaaaaaaaaaaaaaaaaaaaaaaaaaaaaaaaaaaaaaaaaaaaaaaaa",
          "policyHash": "bbbbbbbbbbbbbbbbbbbbbbbbbbbbbbbbbbbbbbbbbbbbbbbbbbbbbbbbbbbbbbbb",
          "tenantId": "attacker-controlled"
        },
        "publicKeyId": "test-vectors:key_v1",
        "signature": "cDfYrmT+C+DWcJJtDD+EZy1LyTwViUhGDUkRWcbFZSuV51B1NdcIa/ADeaWRcoicQXuLMFeWtRR03U93KQTNDQ==",
        "timestamp": 1767225600000
      },
      "keySet": [
        {
          "keyId": "test-vectors:key_v1",
          "algorithm": "ed25519",
          "publicKey": "MCowBQYDK2VwAyEArI9wKSGHg7Ig9ZtbOg+7d/QSddFvQ9xHSQxJ7ErydFs=",
          "status": "active"
        }
      ],
      "verifyAt": 1767225601000,
      "clockToleranceMs": 0,
      "transparencyProof": null,
      "expected": {
        "verificationStatus": "invalid",
        "signatureValid": false,
        "payloadHashValid": true,
        "canonicalizationValid": true,
        "keyValid": true,
        "keyStatus": "active",
        "timestampValid": true,
        "expiryValid": true,
        "failedStage": "INVALID_SIGNATURE"
      }
    },
    {
      "id": "tampered-signature-bytes",
      "description": "Genuine artifact whose signature has one bit flipped after signing.",
      "tags": [
        "negative",
        "tamper"
      ],
      "artifact": {
        "expiry": 1767229200000,
        "payload": {
          "requestId": "req-conformance-001",
          "requestHash": "aaaaaaaaaaaaaaaaaaaaaaaaaaaaaaaaaaaaaaaaaaaaaaaaaaaaaaaaaaaaaaaa",
          "policyHash": "bbbbbbbbbbbbbbbbbbbbbbbbbbbbbbbbbbbbbbbbbbbbbbbbbbbbbbbbbbbbbbbb",
          "tenantId": "test-vectors"
        },
        "publicKeyId": "test-vectors:key_v1",
        "signature": "cDfYrmT+C+DWcJJtDD+EZy1LyTwViUhGDUkRWcbFZSuV51B1NdcIa/ADeaWRcoicQXuLMFeWtRR03U93KQTNDA==",
        "timestamp": 1767225600000
      },
      "keySet": [
        {
          "keyId": "test-vectors:key_v1",
          "algorithm": "ed25519",
          "publicKey": "MCowBQYDK2VwAyEArI9wKSGHg7Ig9ZtbOg+7d/QSddFvQ9xHSQxJ7ErydFs=",
          "status": "active"
        }
      ],
      "verifyAt": 1767225601000,
      "clockToleranceMs": 0,
      "transparencyProof": null,
      "expected": {
        "verificationStatus": "invalid",
        "signatureValid": false,
        "payloadHashValid": true,
        "canonicalizationValid": true,
        "keyValid": true,
        "keyStatus": "active",
        "timestampValid": true,
        "expiryValid": true,
        "failedStage": "INVALID_SIGNATURE"
      }
    },
    {
      "id": "wrong-public-key",
      "description": "Genuine artifact, but the verifier's trust bundle maps publicKeyId to an unrelated public key — proves the SDK cryptographically verifies against the resolved key rather than trusting the publicKeyId label alone.",
      "tags": [
        "negative",
        "key"
      ],
      "artifact": {
        "expiry": 1767229200000,
        "payload": {
          "requestId": "req-conformance-001",
          "requestHash": "aaaaaaaaaaaaaaaaaaaaaaaaaaaaaaaaaaaaaaaaaaaaaaaaaaaaaaaaaaaaaaaa",
          "policyHash": "bbbbbbbbbbbbbbbbbbbbbbbbbbbbbbbbbbbbbbbbbbbbbbbbbbbbbbbbbbbbbbbb",
          "tenantId": "test-vectors"
        },
        "publicKeyId": "test-vectors:key_v1",
        "signature": "cDfYrmT+C+DWcJJtDD+EZy1LyTwViUhGDUkRWcbFZSuV51B1NdcIa/ADeaWRcoicQXuLMFeWtRR03U93KQTNDQ==",
        "timestamp": 1767225600000
      },
      "keySet": [
        {
          "keyId": "test-vectors:key_v1",
          "algorithm": "ed25519",
          "publicKey": "MCowBQYDK2VwAyEAGj+ZQMJsr8wuTa8hNQLnxunF+LXkr2/2aZ9aNEAlOOw=",
          "status": "active"
        }
      ],
      "verifyAt": 1767225601000,
      "clockToleranceMs": 0,
      "transparencyProof": null,
      "expected": {
        "verificationStatus": "invalid",
        "signatureValid": false,
        "payloadHashValid": true,
        "canonicalizationValid": true,
        "keyValid": true,
        "keyStatus": "active",
        "timestampValid": true,
        "expiryValid": true,
        "failedStage": "INVALID_SIGNATURE"
      }
    },
    {
      "id": "unknown-key-id",
      "description": "Genuine artifact, but its publicKeyId is absent from the verifier's trust bundle entirely.",
      "tags": [
        "negative",
        "key"
      ],
      "artifact": {
        "expiry": 1767229200000,
        "payload": {
          "requestId": "req-conformance-001",
          "requestHash": "aaaaaaaaaaaaaaaaaaaaaaaaaaaaaaaaaaaaaaaaaaaaaaaaaaaaaaaaaaaaaaaa",
          "policyHash": "bbbbbbbbbbbbbbbbbbbbbbbbbbbbbbbbbbbbbbbbbbbbbbbbbbbbbbbbbbbbbbbb",
          "tenantId": "test-vectors"
        },
        "publicKeyId": "test-vectors:key_v1",
        "signature": "cDfYrmT+C+DWcJJtDD+EZy1LyTwViUhGDUkRWcbFZSuV51B1NdcIa/ADeaWRcoicQXuLMFeWtRR03U93KQTNDQ==",
        "timestamp": 1767225600000
      },
      "keySet": [],
      "verifyAt": 1767225601000,
      "clockToleranceMs": 0,
      "transparencyProof": null,
      "expected": {
        "verificationStatus": "invalid",
        "signatureValid": false,
        "payloadHashValid": true,
        "canonicalizationValid": true,
        "keyValid": false,
        "keyStatus": null,
        "timestampValid": false,
        "expiryValid": false,
        "failedStage": "KEY_RESOLUTION"
      }
    },
    {
      "id": "revoked-key-id",
      "description": "Genuine artifact, but the resolved key's status is \"revoked\" in the verifier's trust bundle.",
      "tags": [
        "negative",
        "key"
      ],
      "artifact": {
        "expiry": 1767229200000,
        "payload": {
          "requestId": "req-conformance-001",
          "requestHash": "aaaaaaaaaaaaaaaaaaaaaaaaaaaaaaaaaaaaaaaaaaaaaaaaaaaaaaaaaaaaaaaa",
          "policyHash": "bbbbbbbbbbbbbbbbbbbbbbbbbbbbbbbbbbbbbbbbbbbbbbbbbbbbbbbbbbbbbbbb",
          "tenantId": "test-vectors"
        },
        "publicKeyId": "test-vectors:key_v1",
        "signature": "cDfYrmT+C+DWcJJtDD+EZy1LyTwViUhGDUkRWcbFZSuV51B1NdcIa/ADeaWRcoicQXuLMFeWtRR03U93KQTNDQ==",
        "timestamp": 1767225600000
      },
      "keySet": [
        {
          "keyId": "test-vectors:key_v1",
          "algorithm": "ed25519",
          "publicKey": "MCowBQYDK2VwAyEArI9wKSGHg7Ig9ZtbOg+7d/QSddFvQ9xHSQxJ7ErydFs=",
          "status": "revoked"
        }
      ],
      "verifyAt": 1767225601000,
      "clockToleranceMs": 0,
      "transparencyProof": null,
      "expected": {
        "verificationStatus": "invalid",
        "signatureValid": false,
        "payloadHashValid": true,
        "canonicalizationValid": true,
        "keyValid": false,
        "keyStatus": "revoked",
        "timestampValid": false,
        "expiryValid": false,
        "failedStage": "KEY_RESOLUTION"
      }
    },
    {
      "id": "expired-artifact",
      "description": "Genuine artifact verified 4 seconds after its own expiry.",
      "tags": [
        "negative",
        "time"
      ],
      "artifact": {
        "expiry": 1767225601000,
        "payload": {
          "requestId": "req-conformance-002",
          "requestHash": "cccccccccccccccccccccccccccccccccccccccccccccccccccccccccccccccc",
          "policyHash": "dddddddddddddddddddddddddddddddddddddddddddddddddddddddddddddddd",
          "tenantId": "test-vectors"
        },